Index,Title,DOI,Points3,Determination of the Crystal Structure of Substrate-Induced Pentacene Polymorphs in Fiber Structured Thin Films,https://doi.org/10.1021/ja0730516,0
3,Polymorphism in Alzheimer Aβ Amyloid Organization Reflects Conformational Selection in a Rugged Energy Landscape,https://doi.org/10.1021/cr900377t,0
3,MHC polymorphism and parasites,https://doi.org/10.1098/rstb.1994.0152,0
3,Epitaxial stabilization and phase instability of VO2 polymorphs,https://doi.org/10.1038/srep19621,0
3,<i>p</i>53 polymorphisms and haplotypes in breast cancer,https://doi.org/10.1093/carcin/17.6.1313,0
3,Lipid-lowering response to statins is affected by CYP3A5 polymorphism,https://doi.org/10.1097/01.fpc.0000114762.78957.a5,0
3,"Opsonic Activity, Phagocytosis, and Bactericidal Capacity of Polymorphs in Undernutrition",https://doi.org/10.1136/adc.47.252.282,0
3,"Reification, polymorphism and reuse",https://doi.org/10.1145/345513.345267,0
3,Polymorphism in Processes of Crystallization in Solution: A Practical Review,https://doi.org/10.1021/op900168f,0
3,"Alcohol and aldehyde dehydrogenase gene polymorphisms and oropharyngolaryngeal, esophageal and stomach cancers in Japanese alcoholics",https://doi.org/10.1093/carcin/22.3.433,0
3,Crystallisation of Polymorphs: Thermodynamic Insight into the Role of Solvent,https://doi.org/10.1021/op000058y,0
3,Association Between Polymorphism in the Chemokine Receptor CX3CR1 and Coronary Vascular Endothelial Dysfunction and Atherosclerosis,https://doi.org/10.1161/hh1701.095642,0
3,Organic Polymorphs: One‐Compound‐Based Crystals with Molecular‐Conformation‐ and Packing‐Dependent Luminescent Properties,https://doi.org/10.1002/adma.201401114,0
3,Polymorphism in the thymidylate synthase promoter enhancer region in colorectal cancer,https://doi.org/10.3892/ijo.19.2.383,0
3,Solvation and surface effects on polymorph stabilities at the nanoscale,https://doi.org/10.1039/c6sc03457h,0
3,Association of the Asp312Asn and Lys751Gln polymorphisms in the XPD gene with the risk of non-Hodgkin’s lymphoma: evidence from a meta-analysis,https://doi.org/10.1186/s40880-015-0001-2,0
3,Optimization of Terminal-Restriction Fragment Length Polymorphism Analysis for Complex Marine Bacterioplankton Communities and Comparison with Denaturing Gradient Gel Electrophoresis,https://doi.org/10.1128/aem.65.8.3518-3525.1999,0
3,Polymorphism: The Same and Not Quite the Same,https://doi.org/10.1021/cg701000q,0
3,"Polymorphisms of the tumour necrosis factor‐α gene, coronary heart disease and obesity",https://doi.org/10.1046/j.1365-2362.1998.00244.x,0
3,Relation of an Interleukin-10 Promoter Polymorphism to Graft-versus-Host Disease and Survival after Hematopoietic-Cell Transplantation,https://doi.org/10.1056/nejmoa022060,0
3,Interleukin–1 receptor antagonist gene polymorphism as a disease severity factor in systemic lupus erythematosus,https://doi.org/10.1002/art.1780370917,0
3,Adverse drug reactions to azathioprine therapy are associated with polymorphism in the gene encoding inosine triphosphate pyrophosphatase (ITPase),https://doi.org/10.1097/00008571-200403000-00006,0
3,The Role of Red Blood Cell Polymorphisms in Resistance and Susceptibility to Malaria,https://doi.org/10.1086/515193,0
3,IL-10R Polymorphisms Are Associated with Very-early-onset Ulcerative Colitis,https://doi.org/10.1002/ibd.22974,0
3,UDP-glucuronosyltransferase (UGT1A1*28 and UGT1A6*2) polymorphisms in Caucasians and Asians,https://doi.org/10.1097/00008571-199906000-00009,0
3,A multivariate analysis of genomic polymorphisms: prediction of clinical outcome to 5-FU/oxaliplatin combination chemotherapy in refractory colorectal cancer,https://doi.org/10.1038/sj.bjc.6601975,0
3,The Association of Sport Performance with ACE and ACTN3 Genetic Polymorphisms: A Systematic Review and Meta-Analysis,https://doi.org/10.1371/journal.pone.0054685,0
3,The p53 codon 72 polymorphism and lung cancer risk.,,0
3,NOD2/CARD15 gene polymorphisms and Crohn's disease in the Chinese population,https://doi.org/10.1046/j.1365-2036.2003.01607.x,0
3,Silent Nucleotide Polymorphisms and a Phylogeny for<i>Mycobacterium tuberculosis</i>,https://doi.org/10.3201/eid1009.040046,0
3,Average heterozygosity per locus in man: an estimate based on the incidence of enzyme polymorphisms,https://doi.org/10.1111/j.1469-1809.1972.tb00578.x,0
3,DNA repair polymorphisms and cancer risk in non-smokers in a cohort study,https://doi.org/10.1093/carcin/bgi280,0
3,The Polymorphism of Potassium Nitrate,https://doi.org/10.1021/j150308a001,0
3,The Polymorphism of Tristearin and Some of its Homologs,https://doi.org/10.1021/ja01220a008,0
3,CYP1A1 genetic polymorphisms and in situ colorectal cancer.,,0
3,Accessory Gene Regulator Group II Polymorphism in Methicillin-Resistant Staphylococcus aureus Is Predictive of Failure of Vancomycin Therapy,https://doi.org/10.1086/421092,0
3,β Fibrinogen Gene Polymorphisms Are Associated With Plasma Fibrinogen and Coronary Artery Disease in Patients With Myocardial Infarction,https://doi.org/10.1161/01.cir.93.3.440,0
3,"Cytochrome P450IIE1 genetic polymorphisms, racial variation, and lung cancer risk.",,0
3,Inferring the evolutionary histories of the Adh and Adh-dup loci in Drosophila melanogaster from patterns of polymorphism and divergence.,https://doi.org/10.1093/genetics/127.3.565,0
3,"Hydrothermal synthesis and characterisation of BaTiO3 fine powders: precursors, polymorphism and properties",https://doi.org/10.1039/a805756g,0
3,"High plasma pravastatin concentrations are associated with single nucleotide polymorphisms and haplotypes of organic anion transporting polypeptide-C (OATP-C, SLCO1B1)",https://doi.org/10.1097/01.fpc.0000114750.08559.32,0
3,A study of the origin of ‘shadow bands’ seen when typing dinucleotide repeat polymorphisms by the PCR,https://doi.org/10.1093/hmg/2.4.411,0
3,Influence of CYP3A5 and MDR1 (ABCB1) Polymorphisms on the Pharmacokinetics of Tacrolimus in Renal Transplant Recipients,https://doi.org/10.1097/01.tp.0000137789.58694.b4,0
3,Molecular genetics of the debrisoquin-sparteine polymorphism,https://doi.org/10.1038/clpt.1991.131,0
3,Nuclear Gene Indicates Coat-Color Polymorphism in Mammoths,https://doi.org/10.1126/science.1128994,0
3,Controlling Crystal Polymorphism in Organic-Free Synthesis of Na-Zeolites,https://doi.org/10.1021/ja3105939,0
3,Association of Neonatal Hyperbilirubinemia With Bilirubin UDP-Glucuronosyltransferase Polymorphism,https://doi.org/10.1542/peds.103.6.1224,0
3,"Female Polymorphism, Frequency Dependence, and Rapid Evolutionary Dynamics in Natural Populations",https://doi.org/10.1086/429278,0
3,Colorectal Cancer: Molecular Mutations and Polymorphisms,https://doi.org/10.3389/fonc.2013.00114,0
3,Dinucleotide repeat polymorphisms at the D17S250 and D17S261 loci,https://doi.org/10.1093/nar/18.15.4640-a,0
3,Apolipoprotein A-I Gene Polymorphism Associated with Premature Coronary Artery Disease and Familial Hypoalphalipoproteinemia,https://doi.org/10.1056/nejm198603133141102,0
3,"Solvent Induced Polymorphism in Supramolecular 1,3,5-Benzenetribenzoic Acid Monolayers",https://doi.org/10.1021/jp057553m,0
3,Shape-Anisotropy Driven Symmetry Transformations in Nanocrystal Superlattice Polymorphs,https://doi.org/10.1021/nn103303q,0
3,Functional polymorphisms in the transcription factor <i>NRF2</i> in humans increase the risk of acute lung injury,https://doi.org/10.1096/fj.06-7759com,0
3,Amino acid substitution in the dopamine D3 receptor as a useful polymorphism for investigating psychiatric disorders,https://doi.org/10.1097/00041444-199210000-00003,0
3,The Application of Restriction Fragment Length Polymorphism to Plant Breeding,https://doi.org/10.1007/978-1-4684-4556-5_4,0
3,Glutathione peroxidase codon 198 polymorphism variant increases lung cancer risk.,,0
3,Polyadenylation polymorphism in the acetyltransferase 1 gene (NAT1) increases risk of colorectal cancer.,,0
3,Bupropion and 4-OH-bupropion pharmacokinetics in relation to genetic polymorphisms in CYP2B6,https://doi.org/10.1097/00008571-200310000-00005,0
3,Impact of apolipoprotein E polymorphism on lipoproteins and risk of myocardial infarction. The ECTIM Study.,https://doi.org/10.1161/01.atv.14.9.1412,0
3,Gelatinization temperature of rice explained by polymorphisms in starch synthase,https://doi.org/10.1111/j.1467-7652.2005.00162.x,0
3,Irinotecan pharmacokinetics/pharmacodynamics and UGT1A genetic polymorphisms in Japanese: roles of UGT1A1*6 and *28,https://doi.org/10.1097/fpc.0b013e328014341f,0
3,Genetic origins of anxiety in women: a role for a functional catechol-O-methyltransferase polymorphism,https://doi.org/10.1097/00041444-200303000-00006,0
3,Association between manganese superoxide dismutase (MnSOD) gene polymorphism and breast cancer risk,https://doi.org/10.1093/carcin/22.5.827,0
3,Single Nucleotide Polymorphisms in Multiple Novel Thrombospondin Genes May Be Associated With Familial Premature Myocardial Infarction,https://doi.org/10.1161/hc4701.100910,0
3,Habitat Choice and Phenotype‐Limited Feeding Efficiency in Bluegill: Individual Differences and Trophic Polymorphism,https://doi.org/10.2307/1937360,0
3,Mitochondrial DNA G10398A Polymorphism and Invasive Breast Cancer in African-American Women,https://doi.org/10.1158/0008-5472.can-05-1428,0
3,Association of a Triallelic Serotonin Transporter Gene Promoter Region (5-HTTLPR) Polymorphism With Stressful Life Events and Severity of Depression,https://doi.org/10.1176/ajp.2006.163.9.1588,0
3,Exploring Polymorphism: The Case of Benzene,https://doi.org/10.1002/anie.200462760,0
3,Association of Polymorphisms in the CRP Gene With Circulating C-Reactive Protein Levels and Cardiovascular Events,https://doi.org/10.1001/jama.296.22.2703,0
3,Stable Polymorphisms in a Selection Model with Mutation,https://doi.org/10.1137/0141001,0
3,Single-Nucleotide Polymorphism–Based Noninvasive Prenatal Screening in a High-Risk and Low-Risk Cohort,https://doi.org/10.1097/aog.0000000000000363,0
3,Tetranucleotide repeat polymorphism at the human c-fes/fps proto-oncogene (FES),https://doi.org/10.1093/nar/19.14.4018,0
3,Correlation between Molecular Packing and Optical Properties in Different Crystalline Polymorphs and Amorphous Thin Films of <i>mer</i>-Tris(8-hydroxyquinoline)aluminum(III),https://doi.org/10.1021/ja993608k,0
3,Novel Single Nucleotide Polymorphisms in the Distal IL-10 Promoter Affect IL-10 Production and Enhance the Risk of Systemic Lupus Erythematosus,https://doi.org/10.4049/jimmunol.166.6.3915,0
3,"5,10 Methylenetetrahydrofolate reductase genetic polymorphism as a risk factor for neural tube defects",https://doi.org/10.1002/(sici)1096-8628(19960628)63:4<610::aid-ajmg15>3.0.co;2-l,0
3,Metoprolol metabolism and debrisoquine oxidation polymorphism‐ population and family studies.,https://doi.org/10.1111/j.1365-2125.1985.tb05112.x,0
3,Polymorphism of Bismuth Trioxide<sup>1</sup>,https://doi.org/10.1021/ja01246a013,0
3,"<i>TLR4</i>polymorphisms, infectious diseases, and evolutionary pressure during migration of modern humans",https://doi.org/10.1073/pnas.0704828104,0
3,Gene copy-number polymorphism in nature,https://doi.org/10.1098/rspb.2010.1180,0
3,Polymorphism of carbon oxidation of drugs and clinical implications.,https://doi.org/10.1136/bmj.2.6138.655,0
3,A simple technique for handling multiple polymorphism,https://doi.org/10.1145/960112.28732,0
3,"Direct Link Between <i>mhc</i> Polymorphism, T Cell Avidity, and Diversity in Immune Defense",https://doi.org/10.1126/science.1076064,0
3,Association of Restriction Fragment Length Polymorphisms among Maize Inbreds with Agronomic Performance of Their Crosses,https://doi.org/10.2135/cropsci1989.0011183x002900040050x,0
3,Genetic polymorphism of CYP2C9 and its effect on warfarin maintenance dose requirement in patients undergoing anticoagulation therapy,https://doi.org/10.1097/00008571-199512000-00008,0
3,Endothelial Nitric Oxide Synthase Gene Polymorphisms and Cardiovascular Disease: A HuGE Review,https://doi.org/10.1093/aje/kwj302,0
3,Circular RNAs are depleted of polymorphisms at microRNA binding sites,https://doi.org/10.1093/bioinformatics/btu257,0
3,Use of a Dense Single Nucleotide Polymorphism Map for In Silico Mapping in the Mouse,https://doi.org/10.1371/journal.pbio.0020393,0
3,Alary Polymorphism in the Gerroidea (Hemiptera-Heteroptera),https://doi.org/10.2307/2079,0
3,Polymorphism in nickel hydroxide: role of interstratification,https://doi.org/10.1039/a905651c,0
3,Gel-Induced Selective Crystallization of Polymorphs,https://doi.org/10.1021/ja210006t,0
3,MDR1 gene polymorphisms affect therapy outcome in acute myeloid leukemia patients.,,0
3,Computer Simulation to Predict Possible Crystal Polymorphs,https://doi.org/10.1002/9780470125892.ch7,0
3,INVOLVEMENT OF GENETIC POLYMORPHISM OF ALCOHOL AND ALDEHYDE DEHYDROGENASES IN INDIVIDUAL VARIATION OF ALCOHOL METABOLISM,https://doi.org/10.1093/oxfordjournals.alcalc.a045609,0
3,Risk of Childhood Leukemia Associated with Exposure to Pesticides and with Gene Polymorphisms,https://doi.org/10.1097/00001648-199909000-00004,0
3,Polymorph,https://doi.org/10.1145/1814256.1814267,0
3,GERMANIUM. XXXIX. THE POLYMORPHISM OF GERMANIUM DIOXIDE<sup>1</sup>,https://doi.org/10.1021/ja01345a019,0
3,Mannose‐binding lectin polymorphisms and susceptibility to infection in systemic lupus erythematosus,https://doi.org/10.1002/1529-0131(199910)42:10<2145::aid-anr15>3.0.co;2-#,0
3,Synthesis and structure of pure SiO2 chabazite: the SiO2 polymorph with the lowest framework density,https://doi.org/10.1039/a804800b,0
3,A Genetic Polymorphism in the Swordtail Xiphophorus nigrensis: Testing the Prediction of Equal Fitnesses,https://doi.org/10.1086/285311,0
3,Genetic Polymorphism of CYP1A2 in Ethiopians Affecting Induction and Expression: Characterization of Novel Haplotypes with Single-Nucleotide Polymorphisms in Intron 1,https://doi.org/10.1124/mol.64.3.659,0
3,Cytokine gene polymorphisms in patients infected with hepatitis B virus,https://doi.org/10.1111/j.1572-0241.2003.07179.x,0
3,Nanostructured Nb<sub>2</sub>O<sub>5</sub> Polymorphs by Electrospinning for Rechargeable Lithium Batteries,https://doi.org/10.1021/jp9088589,0
3,Algorithmic strategies for the single nucleotide polymorphism haplotype assembly problem,https://doi.org/10.1093/bib/3.1.23,0
3,Mining for Single Nucleotide Polymorphisms and Insertions/Deletions in Maize Expressed Sequence Tag Data,https://doi.org/10.1104/pp.102.019422,0
3,Common Estrogen Receptor Polymorphism Augments Effects of Hormone Replacement Therapy on E-Selectin but Not C-Reactive Protein,https://doi.org/10.1161/01.cir.0000016173.98826.88,0
3,GENETIC VARIATION IN NATURAL POPULATIONS OF FIVE DROSOPHILA SPECIES AND THE HYPOTHESIS OF THE SELECTIVE NEUTRALITY OF PROTEIN POLYMORPHISMS,https://doi.org/10.1093/genetics/77.2.343,0
3,"Adaptive Strategies: Polymorphism, Plasticity, and Homeostasis",https://doi.org/10.1007/978-1-349-04627-0_8,0
3,"CD33 Alzheimer's Risk-Altering Polymorphism, CD33 Expression, and Exon 2 Splicing",https://doi.org/10.1523/jneurosci.1224-13.2013,0
3,Pure Polymorph C of Zeolite Beta Synthesized by Using Framework Isomorphous Substitution as a Structure-Directing Mechanism,https://doi.org/10.1002/1521-3773(20010618)40:12<2277::aid-anie2277>3.0.co;2-o,0
3,Common genetic polymorphisms affect the human requirement for the nutrient choline,https://doi.org/10.1096/fj.06-5734com,0
3,Ranking non-synonymous single nucleotide polymorphisms based on disease concepts,https://doi.org/10.1186/1479-7364-8-11,0
3,Polymorphism of Amyloid Fibrils In Vivo,https://doi.org/10.1002/anie.201511524,0
3,nsSNPAnalyzer: identifying disease-associated nonsynonymous single nucleotide polymorphisms,https://doi.org/10.1093/nar/gki372,0
3,Polymorphisms of the DNA repair gene XRCC1 and lung cancer risk.,,0
3,DNA Mismatch Repair Gene Polymorphisms Affect Survival in Pancreatic Cancer,https://doi.org/10.1634/theoncologist.2010-0127,0
3,DNA polymorphism at the apolipoprotein B locus is associated with lipoprotein level,https://doi.org/10.1111/j.1399-0004.1986.tb01920.x,0
3,Metoprolol and mephenytoin oxidation polymorphisms in Far Eastern Oriental subjects: Japanese versus mainland Chinese,https://doi.org/10.1038/clpt.1989.126,0
3,Understanding Polymorphism in Organic Semiconductor Thin Films through Nanoconfinement,https://doi.org/10.1021/ja507179d,0
3,FCGR2A and FCGR3A Polymorphisms Associated With Clinical Outcome of Epidermal Growth Factor Receptor–Expressing Metastatic Colorectal Cancer Patients Treated With Single-Agent Cetuximab,https://doi.org/10.1200/jco.2006.08.8021,0
3,Neutral behavior of shared polymorphism,https://doi.org/10.1073/pnas.94.15.7730,0
3,"Association Between Glutathione S-Transferase P1, T1, and M1 Genetic Polymorphism and Survival of Patients With Metastatic Colorectal Cancer",https://doi.org/10.1093/jnci/94.12.936,0
3,The Origins of Extraversion: Joint Effects of Facultative Calibration and Genetic Polymorphism,https://doi.org/10.1177/0146167210397209,0
3,Predicting Type 2 Diabetes Based on Polymorphisms From Genome-Wide Association Studies,https://doi.org/10.2337/db08-0425,0
3,Whole genome sequencing options for bacterial strain typing and epidemiologic analysis based on single nucleotide polymorphism versus gene-by-gene–based approaches,https://doi.org/10.1016/j.cmi.2017.12.016,0
3,The −174G/C Interleukin-6 Polymorphism Influences Postoperative Interleukin-6 Levels and Postoperative Atrial Fibrillation. Is Atrial Fibrillation an Inflammatory Complication?,https://doi.org/10.1161/01.cir.0000087441.48566.0d,0
3,Debye temperature and stiffness of carbon and boron nitride polymorphs from first principles calculations,https://doi.org/10.1103/physrevb.73.064304,0
3,Synergistic effect of crystal and electronic structures on the visible-light-driven photocatalytic performances of Bi2O3 polymorphs,https://doi.org/10.1039/c0cp01189d,0
3,Natural Selection and the Frequency Distributions of “Silent” DNA Polymorphism in Drosophila,https://doi.org/10.1093/genetics/146.1.295,0
3,Mitochondrial DNA analysis: polymorphisms and pathogenicity,https://doi.org/10.1136/jmg.36.7.505,0
3,Prostate cancer risk and polymorphism in 17 hydroxylase (CYP17) and steroid reductase (SRD5A2),https://doi.org/10.1093/carcin/20.9.1727,0
3,Vascular Endothelial Growth Factor Polymorphisms in Relation to Breast Cancer Development and Prognosis,https://doi.org/10.1158/1078-0432.ccr-04-1803,0
3,Cytochrome P450 1B1 (CYP1B1) pharmacogenetics: association of polymorphisms with functional differences in estrogen hydroxylation activity.,,0
3,Assessing Population Differentiation and Isolation from Single-Nucleotide Polymorphism Data,https://doi.org/10.1111/1467-9868.00357,0
3,Polymorphisms of DNA Repair Genes and Risk of Glioma,https://doi.org/10.1158/0008-5472.can-03-2181,0
3,Genetic polymorphism and protein conformational plasticity in the calmodulin superfamily: Two ways to promote multifunctionality,https://doi.org/10.1073/pnas.0508640103,0
3,Polymorphisms in Human Soluble Epoxide Hydrolase,https://doi.org/10.1124/mol.64.2.482,0
3,ERCC2 /XPD Gene Polymorphisms and Lung Cancer: A HuGE Review,https://doi.org/10.1093/aje/kwi018,0
3,"Structure, Function, Expression, Genomic Organization, and Single Nucleotide Polymorphisms of Human ABCB1 (MDR1), ABCC (MRP), and ABCG2 (BCRP) Efflux Transporters",https://doi.org/10.1080/10915810600746023,0
3,Long‐Term Experimental Evolution in<i>Escherichia coli</i>. VIII. Dynamics of a Balanced Polymorphism,https://doi.org/10.1086/303299,0
3,"Cytochrome P450 2C19 loss-of-function polymorphism, but not CYP3A4 IVS10+12G/A and P2Y12 T744C polymorphisms, is associated with response variability to dual antiplatelet treatment in high-risk vascular patients",https://doi.org/10.1097/fpc.0b013e3282f1b2be,0
3,A natural polymorphism in β-lactamase is a global suppressor,https://doi.org/10.1073/pnas.94.16.8801,0
3,ADAPTATION AT SPECIFIC LOCI. II. DEMOGRAPHIC AND BIOCHEMICAL ELEMENTS IN THE MAINTENANCE OF THE COLIAS PGI POLYMORPHISM,https://doi.org/10.1093/genetics/103.4.691,0
3,"Androgen Receptor Polymorphisms (CAG Repeat Lengths) in Androgenetic Alopecia, Hirsutism, and Acne",https://doi.org/10.1177/120347549800300103,0
3,Multiplexed single nucleotide polymorphism genotyping by oligonucleotide ligation and flow cytometry,https://doi.org/10.1002/(sici)1097-0320(20000201)39:2<131::aid-cyto6>3.0.co;2-u,0
3,Genetic Polymorphism of Methylenetetrahydrofolate Reductase and Myocardial Infarction,https://doi.org/10.1161/01.cir.94.8.1812,0
3,Risk of Coronary Artery Disease Associated With Polymorphism of the Cytochrome P450 Epoxygenase CYP2J2,https://doi.org/10.1161/01.cir.0000143832.91812.60,0
3,A strategy for producing predicted polymorphs: catemeric carbamazepine form V,https://doi.org/10.1039/c1cc11634g,0
3,Secretion of Tumour Necrosis Factor α and Lymphotoxin α in Relation to Polymorphisms in the TNF Genes and HLA‐DR Alleles. Relevance for Inflammatory Bowel Disease,https://doi.org/10.1046/j.1365-3083.1996.d01-65.x,0
3,Humanized TREM2 mice reveal microglia-intrinsic and -extrinsic effects of R47H polymorphism,https://doi.org/10.1084/jem.20171529,0
3,"Different contributions of polymorphisms in VKORC1 and CYP2C9 to intra- and inter-population differences in maintenance dose of warfarin in Japanese, Caucasians and African-Americans",https://doi.org/10.1097/01.fpc.0000184955.08453.a8,0
3,Parasite-associated polymorphism in a cyclic ungulate population,https://doi.org/10.1098/rspb.1993.0119,0
3,Association of Angiotensin-Converting Enzyme Gene <i>I/D</i> Polymorphism With Change in Left Ventricular Mass in Response to Physical Training,https://doi.org/10.1161/01.cir.96.3.741,0
3,Structural polymorphism in the N-terminal oligomerization domain of NPM1,https://doi.org/10.1073/pnas.1321007111,0
3,Sensitive detection of DNA polymorphisms by the serial invasive signal amplification reaction,https://doi.org/10.1073/pnas.140225597,0
3,Genetic regulation of a structural polymorphism of human C3b receptor.,https://doi.org/10.1172/jci111018,0
3,A Polymorphism in the Cyclooxygenase 2 Gene as an Inherited Protective Factor Against Myocardial Infarction and Stroke,https://doi.org/10.1001/jama.291.18.2221,0
3,Toll‐like receptor polymorphism in host immune response to infectious diseases: A review,https://doi.org/10.1111/sji.12771,0
3,Polymorphism in glutathione <i>S</i> -transferase P1 is associated with susceptibility to chemotherapy-induced leukemia,https://doi.org/10.1073/pnas.191211198,0
3,Analysis and meta-analysis of two serotonin transporter gene polymorphisms in bipolar and unipolar affective disorders,https://doi.org/10.1002/(sici)1096-8628(19980207)81:1<58::aid-ajmg11>3.0.co;2-v,0
3,The Distribution of the Human Blood Groups and other Polymorphisms,https://doi.org/10.1136/jcp.30.4.392-c,0
3,Chloroquine Resistant Plasmodium vivax: In Vitro Characterisation and Association with Molecular Polymorphisms,https://doi.org/10.1371/journal.pone.0001089,0
3,"A Prospective Study of Plasma Vitamin D Metabolites, Vitamin D Receptor Polymorphisms, and Prostate Cancer",https://doi.org/10.1371/journal.pmed.0040103,0
3,Apolipoprotein E polymorphisms affect atherosclerosis in young males. Pathobiological Determinants of Atherosclerosis in Youth (PDAY) Research Group.,https://doi.org/10.1161/01.atv.11.5.1237,0
3,Ancient roots for polymorphism at the HLA-DQ alpha locus in primates.,https://doi.org/10.1073/pnas.86.24.9986,0
3,The effect of genetic polymorphism of cytochrome P450 CYP2C9 on phenytoin dose requirement,https://doi.org/10.1097/00008571-200106000-00002,0
3,KIR3DL1 Polymorphisms That Affect NK Cell Inhibition by HLA-Bw4 Ligand,https://doi.org/10.4049/jimmunol.175.8.5222,0
3,CYP3A5 GENETIC POLYMORPHISMS IN DIFFERENT ETHNIC POPULATIONS,https://doi.org/10.1124/dmd.105.003822,0
3,Functional characterization of polymorphisms in DNA repair genes using cytogenetic challenge assays.,https://doi.org/10.1289/ehp.6632,0
3,Phenotype-genotype correlation of in vitro SN-38 (active metabolite of irinotecan) and bilirubin glucuronidation in human liver tissue with UGT1A1 promoter polymorphism,https://doi.org/10.1016/s0009-9236(99)70078-0,0
3,A polymorphism within a conserved β <sub>1</sub> -adrenergic receptor motif alters cardiac function and β-blocker response in human heart failure,https://doi.org/10.1073/pnas.0509937103,0
3,dbRIP: A highly integrated database of retrotransposon insertion polymorphisms in humans,https://doi.org/10.1002/humu.20307,0
3,Polymerase Chain Reaction with Confronting Two-pair Primers for Polymorphism Genotyping,https://doi.org/10.1111/j.1349-7006.2000.tb01026.x,0
3,Role of Dispersion Interactions in the Polymorphism and Entropic Stabilization of the Aspirin Crystal,https://doi.org/10.1103/physrevlett.113.055701,0
3,"Hydrothermal Synthesis of VO<sub>2</sub> Polymorphs: Advantages, Challenges and Prospects for the Application of Energy Efficient Smart Windows",https://doi.org/10.1002/smll.201701147,0
3,POLYMORPHISM OF PLASMA TRIGLYCERIDE KINETICS IN NORMAL HUMAN ADULT SUBJECTS,https://doi.org/10.1111/j.0954-6820.1971.tb07395.x,0
3,"Polymorphism of the ABC transporter genes, MDR1, MRP1 and MRP2/cMOAT, in healthy Japanese subjects",https://doi.org/10.1097/00008571-200103000-00008,0
3,Selective polymorph transformation via solvent-drop grinding,https://doi.org/10.1039/b416980h,0
3,C421A polymorphism in the human breast cancer resistance protein gene is associated with low expression of Q141K protein and low-level drug resistance.,,0
