Index,Title,DOI,Points3,Statistical analysis of amplified fragment length polymorphism data: a toolbox for molecular ecologists and evolutionists,https://doi.org/10.1111/j.1365-294x.2007.03435.x,0
3,Review of the polymorphism of saturated even glycerides,https://doi.org/10.1007/bf02634906,0
3,Analysis of Selection on Enzyme Polymorphisms,https://doi.org/10.1146/annurev.ecolsys.30.1.301,0
3,Association of interleukin-1 gene polymorphisms with Alzheimer's disease,https://doi.org/10.1002/1531-8249(200003)47:3<365::aid-ana13>3.0.co;2-g,0
3,A Length Polymorphism in the Circadian Clock Gene Per3 is Linked to Delayed Sleep Phase Syndrome and Extreme Diurnal Preference,https://doi.org/10.1093/sleep/26.4.413,0
3,High‐Efficiency Perovskite Solar Cells Based on the Black Polymorph of HC(NH<sub>2</sub>)<sub>2</sub>PbI<sub>3</sub>,https://doi.org/10.1002/adma.201401137,0
3,Polymorphisms of OATP-C (SLC21A6) and OAT3 (SLC22A8) genes: Consequences for pravastatin pharmacokinetics,https://doi.org/10.1016/s0009-9236(03)00060-2,0
3,"Relationship between the GSTM1 genetic polymorphism and susceptibility to bladder, breast and colon cancer",https://doi.org/10.1093/carcin/14.9.1821,0
3,Cytochrome P450 Gene Polymorphism and Cancer,https://doi.org/10.2174/1389200043335621,0
3,Polymorphism of Red Phosphorus,https://doi.org/10.1021/ja01203a072,0
3,A single nucleotide polymorphism in the matrix metalloproteinase-1 promoter creates an Ets binding site and augments transcription.,,0
3,"Prospective Study of Coronary Heart Disease Incidence in Relation to Fasting Total Homocysteine, Related Genetic Polymorphisms, and B Vitamins",https://doi.org/10.1161/01.cir.98.3.204,0
3,ABCG2 Polymorphism Markedly Affects the Pharmacokinetics of Atorvastatin and Rosuvastatin,https://doi.org/10.1038/clpt.2009.79,0
3,"Single nucleotide polymorphism arrays: a decade of biological, computational and technological advances",https://doi.org/10.1093/nar/gkp552,0
3,Are vitamin D receptor polymorphisms associated with bone mineral density? A meta-analysis,https://doi.org/10.1002/jbmr.5650111203,0
3,D2 and D4 dopamine receptor polymorphisms and personality,https://doi.org/10.1002/(sici)1096-8628(19980508)81:3<257::aid-ajmg10>3.0.co;2-e,0
3,Suicidality and 5-Hydroxyindoleacetic Acid Concentration Associated With a Tryptophan Hydroxylase Polymorphism,https://doi.org/10.1001/archpsyc.1994.03950010034005,0
3,A Robust Algorithm for Copy Number Detection Using High-Density Oligonucleotide Single Nucleotide Polymorphism Genotyping Arrays,https://doi.org/10.1158/0008-5472.can-05-0465,0
3,Cryo-EM structure and polymorphism of Aβ amyloid fibrils purified from Alzheimer’s brain tissue,https://doi.org/10.1038/s41467-019-12683-8,0
3,<i>MUC5B</i> Promoter Polymorphism and Interstitial Lung Abnormalities,https://doi.org/10.1056/nejmoa1216076,0
3,Expression of P-glycoprotein in Human Placenta: Relation to Genetic Polymorphism of the Multidrug Resistance (MDR)-1 Gene,https://doi.org/10.1016/s0022-3565(24)29643-9,0
3,"The Prediction, Morphology, and Mechanical Properties of the Polymorphs of Paracetamol",https://doi.org/10.1021/ja0102787,0
3,Toll-like Receptor 4 Polymorphisms and Aspergillosis in Stem-Cell Transplantation,https://doi.org/10.1056/nejmoa0802629,0
3,Patterns of DNA sequence polymorphism along chromosome 1 of maize ( <i>Zea mays</i> ssp. <i>mays</i> L.),https://doi.org/10.1073/pnas.151244298,0
3,The Developmental Basis of Worker Caste Polymorphism in Ants,https://doi.org/10.1086/285279,0
3,"XRCC1, XRCC3, XPD gene polymorphisms, smoking and 32P-DNA adducts in a sample of healthy subjects",https://doi.org/10.1093/carcin/22.9.1437,0
3,Renin-Angiotensin System Gene Polymorphisms and Atrial Fibrillation,https://doi.org/10.1161/01.cir.0000124487.36586.26,0
3,The glutathione S-transferases: influence of polymorphism on cancer susceptibility.,,0
3,Association of a Polymorphism in the β<sub>3</sub>-Adrenergic–Receptor Gene with Features of the Insulin Resistance Syndrome in Finns,https://doi.org/10.1056/nejm199508103330604,0
3,Single nucleotide polymorphism associated with mature miR-125a alters the processing of pri-miRNA,https://doi.org/10.1093/hmg/ddm062,0
3,Ribotypes and virulence gene polymorphisms suggest three distinct Listeria monocytogenes lineages with differences in pathogenic potential,https://doi.org/10.1128/iai.65.7.2707-2716.1997,0
3,The Effect of Polymorphisms of the β<sub>2</sub>-Adrenergic Receptor on the Response to Regular Use of Albuterol in Asthma,https://doi.org/10.1164/ajrccm.162.1.9907092,0
3,Contribution of trans-acting factor alleles to normal physiological variability: vitamin D receptor gene polymorphism and circulating osteocalcin.,https://doi.org/10.1073/pnas.89.15.6665,0
3,The Minor Histocompatibility Antigen HA-1: A Diallelic Gene with a Single Amino Acid Polymorphism,https://doi.org/10.1126/science.279.5353.1054,0
3,Angiotensin I-converting enzyme in human circulating mononuclear cells: genetic polymorphism of expression in T-lymphocytes,https://doi.org/10.1042/bj2900033,0
3,The Evolution and Function of Stylar Polymorphisms in Flowering Plants,https://doi.org/10.1006/anbo.1999.1067,0
3,The deletion/insertion polymorphism of the angiotensin converting enzyme gene and cardiovascular-renal risk,https://doi.org/10.1097/00004872-199715120-00059,0
3,A Common Dominant TLR5 Stop Codon Polymorphism Abolishes Flagellin Signaling and Is Associated with Susceptibility to Legionnaires' Disease,https://doi.org/10.1084/jem.20031220,0
3,Apolipoprotein B–Gene DNA Polymorphisms Associated with Myocardial Infarction,https://doi.org/10.1056/nejm198612113152403,0
3,Estimation of pleiotropy between complex diseases using single-nucleotide polymorphism-derived genomic relationships and restricted maximum likelihood,https://doi.org/10.1093/bioinformatics/bts474,0
3,Conformational polymorphism. The influence of crystal structure on molecular conformation,https://doi.org/10.1021/ja00471a001,0
3,Collagen polymorphism in normal and cirrhotic human liver.,https://doi.org/10.1172/jci108634,0
3,Insertion polymorphisms of SINE200 retrotransposons within speciation islands of Anopheles gambiae molecular forms,https://doi.org/10.1186/1475-2875-7-163,0
3,Polymorphism of propafenone metabolism and disposition in man: clinical and pharmacokinetic consequences.,https://doi.org/10.1161/01.cir.75.4.785,0
3,Polymorphism of the 5′‐flanking region of the human tumor necrosis factor (TNF)‐α gene in Japanese,https://doi.org/10.1111/j.1399-0039.1998.tb03002.x,0
3,Roles for HLA and KIR polymorphisms in natural killer cell repertoire selection and modulation of effector function,https://doi.org/10.1084/jem.20051884,0
3,An Integrated View of Copy Number and Allelic Alterations in the Cancer Genome Using Single Nucleotide Polymorphism Arrays,https://doi.org/10.1158/0008-5472.can-03-3308,0
3,Endothelial Nitric Oxide Synthase Gene Polymorphism and Acute Myocardial Infarction,https://doi.org/10.1161/01.hyp.32.3.521,0
3,Genomic polymorphisms in sepsis,https://doi.org/10.1097/01.ccm.0000110878.49476.42,0
3,"An allelic polymorphism within the human tumor necrosis factor alpha promoter region is strongly associated with HLA A1, B8, and DR3 alleles.",https://doi.org/10.1084/jem.177.2.557,0
3,Identification of the genomic locations of duplicate nucleotide sequences in maize by analysis of restriction fragment length polymorphisms.,https://doi.org/10.1093/genetics/118.2.353,0
3,Ancestral polymorphism and adaptive evolution in the trichothecene mycotoxin gene cluster of phytopathogenic <i>Fusarium</i>,https://doi.org/10.1073/pnas.142307199,0
3,Polymorphism in Molecular Crystals: Stabilization of a Metastable Form by Conformational Mimicry,https://doi.org/10.1021/ja9626345,0
3,β-Adrenergic Receptor Polymorphisms and Response to Salmeterol,https://doi.org/10.1164/rccm.200509-1519oc,0
3,Haptoglobin: function and polymorphism.,,0
3,Pharmacology and Physiology of Human Adrenergic Receptor polymorphisms,https://doi.org/10.1146/annurev.pharmtox.43.100901.135823,0
3,Phase transitions and polymorphism of cocoa butter,https://doi.org/10.1007/s11746-998-0245-y,0
3,A Comprehensive Map of Mobile Element Insertion Polymorphisms in Humans,https://doi.org/10.1371/journal.pgen.1002236,0
3,Molecular typing of Staphylococcus aureus on the basis of coagulase gene polymorphisms,https://doi.org/10.1128/jcm.30.7.1642-1645.1992,0
3,Single base polymorphism at −511 in the human interleukin-1β gene (IL1β),https://doi.org/10.1093/hmg/1.6.450,0
3,High Pressure Polymorphism in Silica,https://doi.org/10.1103/physrevlett.80.2145,0
3,Genetic polymorphisms and the progression of liver fibrosis: A critical appraisal,https://doi.org/10.1053/jhep.2003.50127,0
3,A Genetic Polymorphism in the Renin Gene of Dahl Rats Cosegregates with Blood Pressure,https://doi.org/10.1126/science.2563177,0
3,Identification of genetically high risk individuals to lung cancer by DNA polymorphisms of the cytochrome P45 0IA1 gene,https://doi.org/10.1016/0014-5793(90)80721-t,0
3,New Polymorphs of ROY and New Record for Coexisting Polymorphs of Solved Structures,https://doi.org/10.1021/ja052098t,0
3,Single nucleotide polymorphisms (SNPs): a new paradigm in molecular marker technology and DNA polymorphism detection with emphasis on their use in plants,,0
3,Ethnicity Greatly Influences Cytokine Gene Polymorphism Distribution,https://doi.org/10.1034/j.1600-6143.2002.20611.x,0
3,A Vitamin D Receptor Gene Polymorphism in the Translation Initiation Codon: Effect on Protein Activity and Relation to Bone Mineral Density in Japanese Women,https://doi.org/10.1359/jbmr.1997.12.6.915,0
3,Metabolic Polymorphisms and Cancer Susceptibility,https://doi.org/10.1007/springerreference_175313,0
3,High Polymorphism at the Human Melanocortin 1 Receptor Locus,https://doi.org/10.1093/genetics/151.4.1547,0
3,X-ray diffraction study of the polymorphism of hydrated diacyl and dialkylphosphatidylethanolamines,https://doi.org/10.1021/bi00307a015,0
3,Amyloid Polymorphism in the Protein Folding and Aggregation Energy Landscape,https://doi.org/10.1002/anie.201713416,0
3,Association of a Promoter Polymorphism of the CD14 Gene and Atopy,https://doi.org/10.1164/ajrccm.163.4.2004164,0
3,Influence of cytokine gene polymorphisms on the development of prostate cancer.,,0
3,The Peroxisome Proliferator-Activated Receptor-γ2 Pro12Ala Polymorphism,https://doi.org/10.2337/diabetes.51.8.2341,0
3,Structures of Uncharacterised Polymorphs of Gallium Oxide from Total Neutron Diffraction,https://doi.org/10.1002/chem.201203359,0
3,Rapid single nucleotide polymorphism mapping in C. elegans,https://doi.org/10.1186/1471-2164-6-118,0
3,A COL1A1 Sp1 binding site polymorphism predisposes to osteoporotic fracture by affecting bone density and quality,https://doi.org/10.1172/jci10347,0
3,The Problems of Polymorphism in Liquid Crystals,https://doi.org/10.1080/15421407308083321,0
3,Codon 72 polymorphism of the TP53 gene,https://doi.org/10.1093/nar/18.16.4961,0
3,Genetic polymorphism of the third component of human complement (C′3),https://doi.org/10.1172/jci105904,0
3,"Manganese superoxide dismutase (MnSOD) genetic polymorphisms, dietary antioxidants, and risk of breast cancer.",,0
3,Insulin-dependent diabetes mellitus (IDDM) is associated with CTLA4 polymorphisms in multiple ethnic groups,https://doi.org/10.1093/hmg/6.8.1275,0
3,Polymorphism in cocrystals: a review and assessment of its significance,https://doi.org/10.1039/c3ce42008f,0
3,On signal sequence polymorphisms and diseases of distribution.,https://doi.org/10.1073/pnas.93.9.4471,0
3,"Molecular-level secondary structure, polymorphism, and dynamics of full-length α-synuclein fibrils studied by solid-state NMR",https://doi.org/10.1073/pnas.0506109102,0
3,Colour polymorphism and correlated characters: genetic mechanisms and evolution,https://doi.org/10.1111/j.1365-294x.2010.04846.x,0
3,Polymorphisms Associated With Circulating Sex Hormone Levels in Postmenopausal Women,https://doi.org/10.1093/jnci/djh167,0
3,Modeling the Polymorphism of Pentacene,https://doi.org/10.1021/ja0211499,0
3,Polymorphisms in DNA repair and metabolic genes in bladder cancer,https://doi.org/10.1093/carcin/bgh058,0
3,Functional Analysis and DNA Polymorphism of the Tandemly Repeated Sequences in the 5'-terminal Regulatory Region of the Human Gene for Thymidylate Synthase.,https://doi.org/10.1247/csf.20.191,0
3,Polymorphism and Charge Transport in Vacuum-Evaporated Sexithiophene Films,https://doi.org/10.1021/cm00046a039,0
3,Polymorphisms in the Glucocorticoid Receptor Gene and Their Associations with Metabolic Parameters and Body Composition,https://doi.org/10.1210/rp.59.1.333,0
3,Human Drug-Metabolizing Enzyme Polymorphisms: Effects on Risk of Toxicity and Cancer,https://doi.org/10.1089/dna.1996.15.273,0
3,Polymorphisms in Human Organic Anion-transporting Polypeptide 1A2 (OATP1A2),https://doi.org/10.1074/jbc.m411092200,0
3,Detection of Single Nucleotide Polymorphisms,https://doi.org/10.21775/cimb.005.043,0
3,Association of prostate cancer with vitamin D receptor gene polymorphism.,,0
3,Reading Bits of Genetic Information: Methods for Single-Nucleotide Polymorphism Analysis,https://doi.org/10.1101/gr.8.8.769,0
3,Crystalline Polymorph Selection and Discovery with Polymer Heteronuclei,https://doi.org/10.1021/ja042561m,0
3,GENETIC POLYMORPHISMS AND SEPSIS,https://doi.org/10.1097/01.shk.0000180621.52058.e1,0
3,Association Between the MUC5B Promoter Polymorphism and Survival in Patients With Idiopathic Pulmonary Fibrosis,https://doi.org/10.1001/jama.2013.5827,0
3,Immunoglobulin G Fragment C Receptor Polymorphisms and Clinical Efficacy of Trastuzumab-Based Therapy in Patients With HER-2/<i>neu</i>–Positive Metastatic Breast Cancer,https://doi.org/10.1200/jco.2007.14.8957,0
3,Methylenetetrahydrofolate reductase polymorphism and pre-eclampsia.,https://doi.org/10.1136/jmg.34.6.525,0
3,Structure and triboluminescence of polymorphs of hexaphenylcarbodiphosphorane,https://doi.org/10.1021/ja00493a035,0
3,Polymorphism in Systematics and Comparative Biology,https://doi.org/10.1146/annurev.ecolsys.30.1.327,0
3,Polymorphisms of DNA repair genes and risk of non-small cell lung cancer,https://doi.org/10.1093/carcin/bgi232,0
3,A novel single nucleotide polymorphism within the 5' tandem repeat polymorphism of the thymidylate synthase gene abolishes USF-1 binding and alters transcriptional activity.,,0
3,CYTOKINE GENE POLYMORPHISM AND HEART TRANSPLANT REJECTION1,https://doi.org/10.1097/00007890-199709150-00021,0
3,A Common Polymorphism in the 5′-Untranslated Region of the VEGF Gene Is Associated With Diabetic Retinopathy in Type 2 Diabetes,https://doi.org/10.2337/diabetes.51.5.1635,0
3,Surface chemistry of zirconia polymorphs,https://doi.org/10.1021/la00085a018,0
3,Hemin−Graphene Hybrid Nanosheets with Intrinsic Peroxidase-like Activity for Label-free Colorimetric Detection of Single-Nucleotide Polymorphism,https://doi.org/10.1021/nn1029586,0
3,Homozygosity for the patatin-like phospholipase-3/adiponutrin I148M polymorphism influences liver fibrosis in patients with nonalcoholic fatty liver disease,https://doi.org/10.1002/hep.23622,0
3,Polymorphism of the thiopurine S-methyltransferase gene in African- Americans,https://doi.org/10.1093/hmg/8.2.371,0
3,A review of colour and pattern polymorphisms in anurans,https://doi.org/10.1111/j.1095-8312.2000.tb00221.x,0
3,Polymorphism at the Apoprotein‐E locus in relation to risk of coronary disease,https://doi.org/10.1111/j.1399-0004.1984.tb01995.x,0
3,Atomistic simulation of the surface structure of the TiO2 polymorphs rutileand anatase,https://doi.org/10.1039/a606353e,0
3,HETEROSIS AS AN EXPLANATION FOR LARGE AMOUNTS OF GENIC POLYMORPHISM,https://doi.org/10.1093/genetics/88.1.149,0
3,"Polymorphism of the human complement C4 and steroid 21-hydroxylase genes. Restriction fragment length polymorphisms revealing structural deletions, homoduplications, and size variants.",https://doi.org/10.1172/jci112623,0
3,Polymorphism at the self-incompatibility locus in Solanaceae predates speciation.,https://doi.org/10.1073/pnas.87.24.9732,0
3,Human Toll‐Like Receptor 4 Mutations but Not CD14 Polymorphisms Are Associated with an Increased Risk of Gram‐Negative Infections,https://doi.org/10.1086/344893,0
3,Molecular basis of albinism: Mutations and polymorphisms of pigmentation genes associated with albinism,https://doi.org/10.1002/(sici)1098-1004(1999)13:2<99::aid-humu2>3.0.co;2-c,0
3,Myeloperoxidase genetic polymorphism and lung cancer risk.,,0
3,Molecular crystalline materials with tunable luminescent properties: from polymorphs to multi-component solids,https://doi.org/10.1039/c3mh00023k,0
3,Pattern of polymorphism after strong artificial selection in a domestication event,https://doi.org/10.1073/pnas.0401720101,0
3,Molecular Dynamics Simulation of the Structural and Physical Properties of the Four Polymorphs of TiO<sub>2</sub>,https://doi.org/10.1080/08927029108022432,0
3,A common polymorphism in the brain‐derived neurotrophic factor gene (<i>BDNF</i>) modulates human cortical plasticity and the response to rTMS,https://doi.org/10.1113/jphysiol.2008.159905,0
3,"Polymorphism of CaCO<sub>3</sub>, precipitated in a constant‐composition environment",https://doi.org/10.1002/aic.690440810,0
3,"The human platelet alloantigens, PlA1 and PlA2, are associated with a leucine33/proline33 amino acid polymorphism in membrane glycoprotein IIIa, and are distinguishable by DNA typing.",https://doi.org/10.1172/jci114082,0
3,Methylenetetrahydrofolate Reductase (MTHFR) Genetic Polymorphisms and Psychiatric Disorders: A HuGE Review,https://doi.org/10.1093/aje/kwj347,0
3,Polymorphism in a varied environment: how robust are the models?,https://doi.org/10.1017/s0016672300013926,0
3,SEED POLYMORPHISM AND GERMINATION,https://doi.org/10.1111/j.1365-3180.1965.tb00337.x,0
3,Pattern of neutral polymorphism in a geographically structured population,https://doi.org/10.1017/s0016672300012520,0
3,Relationship of Paraoxonase 1 (PON1) Gene Polymorphisms and Functional Activity With Systemic Oxidative Stress and Cardiovascular Risk,https://doi.org/10.1001/jama.299.11.1265,0
3,Polymorphisms in the Coagulation Factor VII Gene and the Risk of Myocardial Infarction,https://doi.org/10.1056/nejm199801083380202,0
3,Immunofixation Electrophoresis: A Technique for the Study of Protein Polymorphism<sup>1</sup>,https://doi.org/10.1111/j.1423-0410.1969.tb00414.x,0
3,Interleukin-10 promoter polymorphism predicts initial response of chronic hepatitis C to interferon alfa,https://doi.org/10.1002/hep.510300207,0
3,Single-nucleotide polymorphisms can cause different structural folds of mRNA,https://doi.org/10.1073/pnas.96.14.7871,0
3,Polymorph Selectivity under Nanoscopic Confinement,https://doi.org/10.1021/ja049724r,0
3,Automation in genotyping of single nucleotide polymorphisms,https://doi.org/10.1002/humu.1131,0
3,Positive selection and sequence rearrangements generate extensive polymorphism in the gamete recognition protein bindin,https://doi.org/10.1093/oxfordjournals.molbev.a025598,0
3,Core-controlled polymorphism in virus-like particles,https://doi.org/10.1073/pnas.0610542104,0
3,"Mechanisms of mosaicism, chimerism and uniparental disomy identified by single nucleotide polymorphism array analysis",https://doi.org/10.1093/hmg/ddq003,0
3,Thiopurine Methyltransferase Pharmacogenetics: Human Gene Cloning and Characterization of a Common Polymorphism,https://doi.org/10.1089/dna.1996.15.17,0
3,Human Transferrin Polymorphism,https://doi.org/10.1159/000153680,0
3,"Complement factor H mutations and gene polymorphisms in haemolytic uraemic syndrome: the C-257T, the A2089G and the G2881T polymorphisms are strongly associated with the disease",https://doi.org/10.1093/hmg/ddg363,0
3,Polymorphisms of the Transforming Growth Factor-β1 Gene in Relation to Myocardial Infarction and Blood Pressure,https://doi.org/10.1161/01.hyp.28.5.881,0
3,Vascular Endothelial Growth Factor Gene Polymorphisms Are Associated with Acute Renal Allograft Rejection,https://doi.org/10.1681/asn.v131260,0
3,Comparative Genome Sequencing for Discovery of Novel Polymorphisms in <i>Bacillus anthracis</i>,https://doi.org/10.1126/science.1071837,0
3,A novel functional VKORC1 promoter polymorphism is associated with inter-individual and inter-ethnic differences in warfarin sensitivity,https://doi.org/10.1093/hmg/ddi180,0
3,"Cigarette Smoking, N-Acetyltransferase 2 Genetic Polymorphisms, and Breast Cancer Risk",https://doi.org/10.1001/jama.1996.03540180050032,0
3,hOGG1 Ser326Cys polymorphism and lung cancer susceptibility.,,0
3,Nonradioactive method to study genetic profiles of natural bacterial communities by PCR-single-strand-conformation polymorphism,https://doi.org/10.1128/aem.62.9.3112-3120.1996,0
3,<i>In vitro</i>production of IFN-γ correlates with CA repeat polymorphism in the human IFN-γ gene,https://doi.org/10.1046/j.1365-2370.1999.00122.x,0
3,Molecular keys to speciation: DNA polymorphism and the control of genetic exchange in enterobacteria,https://doi.org/10.1073/pnas.94.18.9763,0
3,Single-Nucleotide Polymorphisms Inside MicroRNA Target Sites Influence Tumor Susceptibility,https://doi.org/10.1158/0008-5472.can-09-3541,0
3,Impact of the -308 TNF promoter polymorphism on the transcriptional regulation of the TNF gene: relevance to disease,https://doi.org/10.1002/jlb.66.4.562,0
3,Molecular basis for a polymorphism of human Fc gamma receptor II (CD32).,https://doi.org/10.1084/jem.172.1.19,0
3,Polymorphisms generated by arbitrarily primed PCR in the mouse: application to strain identification and genetic mapping,https://doi.org/10.1093/nar/19.2.303,0
3,The polymorphism of poly(vinylidene fluoride). I. The effect of head-to-head structure,https://doi.org/10.1080/00222346808212449,0
3,Catechol- O -methyltransferase gene polymorphisms are associated with multiple pain-evoking stimuli,https://doi.org/10.1016/j.pain.2006.05.024,0
3,Polymorphism of DNA Sequence in the β-Globin Gene Region,https://doi.org/10.1056/nejm198001243020401,0
3,Rapid Identification of Rhizobia by Restriction Fragment Length Polymorphism Analysis of PCR-Amplified 16S rRNA Genes,https://doi.org/10.1128/aem.60.1.56-63.1994,0
3,Association Between CYP2D6 Polymorphisms and Outcomes Among Women With Early Stage Breast Cancer Treated With Tamoxifen,https://doi.org/10.1001/jama.2009.1420,0
3,Human CRP Gene Polymorphism Influences CRP Levels,https://doi.org/10.1161/01.atv.0000084640.21712.9c,0
3,Small heat-shock proteins regulate membrane lipid polymorphism,https://doi.org/10.1073/pnas.192468399,0
3,Functional analysis of human promoter polymorphisms,https://doi.org/10.1093/hmg/ddg246,0
3,Extensive polymorphism in the mitochondrial DNA of apes.,https://doi.org/10.1073/pnas.78.10.6319,0
3,"ACE2 receptor polymorphism: Susceptibility to SARS-CoV-2, hypertension, multi-organ failure, and COVID-19 disease outcome",https://doi.org/10.1016/j.jmii.2020.04.015,0
3,Population studies of polymorphisms of the serotonin transporter protein gene.,,0
3,Interleukin-6 gene polymorphism and insulin sensitivity.,https://doi.org/10.2337/diabetes.49.3.517,0
3,Glutathione S-Transferase Polymorphisms and Colorectal Cancer: A HuGE Review,https://doi.org/10.1093/oxfordjournals.aje.a010124,0
3,Polymorphisms in the DNA repair genes XRCC1 and ERCC2 and biomarkers of DNA damage in human blood mononuclear cells,https://doi.org/10.1093/carcin/21.5.965,0
3,Absence of Polymorphism at the ZFY Locus on the Human Y Chromosome,https://doi.org/10.1126/science.7761836,0
3,Possible association of fibromyalgia with a polymorphism in the serotonin transporter gene regulatory region,https://doi.org/10.1002/1529-0131(199911)42:11<2482::aid-anr27>3.0.co;2-b,0
3,Association Between an Aggrecan Gene Polymorphism and Lumbar Disc Degeneration,https://doi.org/10.1097/00007632-199912010-00006,0
3,Association of early-onset Alzheimer's disease with an interleukin-1? gene polymorphism,https://doi.org/10.1002/1531-8249(200003)47:3<361::aid-ana12>3.0.co;2-n,0
3,Enzyme Polymorphism in Mango,https://doi.org/10.21273/jashs.115.5.844,0
3,<i>ACE</i> Gene Polymorphism in Cardiovascular Disease,https://doi.org/10.1161/01.atv.20.2.484,0
3,A polymorphism in the CYP17 gene increases the risk of breast cancer.,,0
3,Trophic radiation through polymorphism in cichlid fishes,https://doi.org/10.1073/pnas.72.11.4669,0
3,Tetranucleotide repeat polymorphism at the human tyrosine hydroxylase gene (TH),https://doi.org/10.1093/nar/19.13.3753,0
3,"Isostructurality, Polymorphism and Mechanical Properties of Some Hexahalogenated Benzenes: The Nature of Halogen⋅⋅⋅Halogen Interactions",https://doi.org/10.1002/chem.200500983,0
3,A MODEL OF ECOLOGICAL AND EVOLUTIONARY CONSEQUENCES OF COLOR POLYMORPHISM,https://doi.org/10.1890/07-0572.1,0
3,"Polymorphism in Molecular Solids: An Extraordinary System of Red, Orange, and Yellow Crystals",https://doi.org/10.1021/ar100040r,0
3,Polymorphism of POP and SOS. I. occurrence and polymorphic transformation,https://doi.org/10.1007/bf02669949,0
3,Relevance of Different UGT1A1 Polymorphisms in Irinotecan-Induced Toxicity,https://doi.org/10.1158/1078-0432.ccr-03-0548,0
3,DNA Extraction Strategies for Amplified Fragment Length Polymorphism Analysis,https://doi.org/10.1520/jfs13711j,0
3,Estimation of Population Parameters and Recombination Rates From Single Nucleotide Polymorphisms,https://doi.org/10.1093/genetics/154.2.931,0
3,Polymorphism of Natural Populations of Cepaea nemoralis,https://doi.org/10.1101/sqb.1959.024.01.009,0
