DOI,Title,Abstract,ID,Is Ecology,Ecology Score
https://doi.org/10.1111/j.1365-3180.2009.00745.x,A new hypothesis for the functional role of diversity in mediating resource pools and weed–crop competition in agroecosystems,"S mith RG, M ortensen DA &amp; R yan MR (2009). A new hypothesis for the functional role of diversity in mediating resource pools and weed–crop competition in agroecosystems. Weed Research. 50, 37–48. Summary We develop a new conceptual model we call the Resource Pool Diversity Hypothesis (RPDH) aimed at explaining how soil resource pool diversity may mediate competition for soil resources between weeds and crops. The primary tenets of the RPDH are that (i) in plant communities, the intensity of inter‐specific competition can depend upon the degree to which niche differentiation and resource partitioning occur among species, (ii) agricultural systems are unique in that management practices, such as crop rotation, source of fertility and weed management, result in inputs to the soil and (iii) these inputs directly or indirectly become soil resource pools from which crops and weeds may partition resources. The RPDH leads to the novel prediction that along a gradient of increasing cropping system diversity, yield loss due to weed–crop competition (i.e. the impact on yield per unit weed density) for soil resources should decrease. Similarly, the degree to which crops and weeds overlap in soil resource niche breadth (which is determined by species‐specific functional traits for resource acquisition), will determine the extent to which weed–crop competition weakens as resource pool diversity increases. While there have been no direct tests of the RPDH, we highlight evidence from the agricultural literature that provides strong support for components of the hypothesis. Validation of the RPDH would have important implications across a broad range of cropping systems for the development of management strategies that aim to reduce yield loss impact per unit weed plant density and the fundamental principles of integrated weed management, such as the concepts of weed thresholds and critical periods.",W1972291563,False,0.5443236231803894
https://doi.org/10.1111/1365-2745.13676,Herbivory of a biocontrol agent on a native plant causes an indirect trait‐mediated non‐target effect on a native insect,"Abstract Identifying food web linkages between biocontrol agents of invasive plants and native species is crucial for predicting indirect non‐target effects. Biocontrol insects can integrate into food webs within recipient habitats and influence native insects through apparent competition (altering shared natural enemies) or density‐mediated exploitation competition (changing density of native plants). However, whether and how trait‐mediated exploitation competition (modifying native plant chemicals and volatiles profiles) can produce indirect non‐target effects remains largely overlooked, despite plant phenotypic responses to insect herbivory being common and widely documented. The flea beetle Agasicles hygrophila was introduced into China for management of alligator weed Alternanthera philoxeroides, but it also attacks the native congener sessile joyweed Alternanthera sessilis, which may cause indirect non‐target effects on the native tortoise beetle Cassida piperata that also feeds on sessile joyweed. Here, we examined the relationships among abundances of the flea beetle and tortoise beetle, and coverage of sessile joyweed in the field. Then, we investigated the impact of flea beetle herbivory on tortoise beetle development and oviposition, as well as on sessile joyweed primary metabolites and leaf volatiles. Tortoise beetle abundance was not related to sessile joyweed coverage, but they were less abundant on plants with more flea beetles in the field survey, and produced fewer offspring on plants with more prior flea beetle damage in the field cage experiment. Tortoise beetle development was inhibited by prior flea beetle herbivory in bioassays in enemy‐free conditions and they preferred to oviposit on sessile joyweed that had experienced little or no flea beetle damage. Flea beetle herbivory decreased sessile joyweed foliar glucose and protein, and substantially changed its leaf volatile blend. Synthesis. Our results show that the flea beetle has major indirect non‐target effects on the tortoise beetle through trait‐mediated exploitation competition, rather than apparent competition or density‐mediated exploitation competition. Our results demonstrate a new example for indirect non‐target effects of biocontrol agents. Furthermore, our results indicate that minor brief negative impacts of biocontrol agents on non‐target plants might propagate to higher trophic levels and such negative impacts can strengthen with increasing intensity of the direct non‐target effect.",W3159289210,False,0.7888161540031433
https://doi.org/10.2307/1564855,Effects of Egg Size and Density on Metamorphic Traits in Tadpoles of the Natterjack Toad (Bufo calamita),"-We examined whether intrapopulational variation in egg size was correlated with developmental rates and metamorphic traits of natterjack toads (Bufo calamita) grown at different experimental densities. Mean egg size of siblings was positively correlated with both mean size of hatchlings at the initiation of feeding and mean developmental rates to the feeding stage. However, size at and survival to metamorphosis were not related to ovum or hatchling size. At high densities tadpoles had slower growth rates, longer larval periods, and lower survival, and were smaller at metamorphosis. Length of larval period was inversely related to early tadpole growth rate for all densities. Mass at metamorphosis was positively correlated to tadpole growth rate, except at high densities. Size at metamorphosis was inversely related to length of larval period at low densities, but relationships were inconsistent at higher densities. Egg size in amphibians has been viewed as a resource tradeoff for females with limited energy for reproduction. This notion is derived in part from optimality models predicting that for each environment there is an optimal offspring size (Smith and Fretwell, 1974; Brockelman, 1975). Others have suggested that optimality theory is contradicted by the high degree of intraclutch egg size variability observed in amphibians (Kaplan, 1980; Crump, 1981). Egg size variability may be adaptive in unpredictable environments such as temporary ponds where the intensity of competition may vary annually. Larvae from larger eggs would be favored in competitive environments due to their initial size advantage, while in noncompetitive environments larger and smaller hatchlings would be equally successful. By producing eggs of mixed sizes females may increase their fitness relative to those following a pure strat146 This content downloaded from 207.46.13.57 on Fri, 09 Sep 2016 04:31:37 UTC All use subject to METAMORPHOSIS IN NATTERJACK TOADS egy (Crump, 1984; Kaplan and Cooper, 1984). This reasoning assumes a positive correlation between egg size and larval fitness in competitive environments. Hence, under this view the covariation is environmentally mediated, and the effect of egg size on larval fitness should be related to population density or food availability (Kaplan, 1985; Berven and Chadra, 1988). In temporary ponds, the length of larval period may be an important fitness component because it is inversely related to larval survival. In some amphibians, individuals that grow relatively fast metamorphose earlier (Wilbur and Collins, 1973; Collins, 1979; Smith-Gill and Berven, 1979; Travis, 1981, 1983, 1984) and may be less susceptible to size-selective predators (Heyer et al., 1975; Brodie and Formanowicz, 1983). Further, time to and size at metamorphosis may have strong ecological implications related to long-term fitness since both can affect juvenile survival, age at first reproduction, or level of adult fecundity (Smith, 1987; Semlitsch et al., 1988; Berven, 1990). The relationship between these two traits is controlled largely by the environment (Travis, 1984), and may vary in consistency and direction. A gradual drop in water temperature during a cohort's development may produce a positive covariation between traits (Smith-Gill and Berven, 1979). Likewise, covariation may result from competitive release as fast-growing tadpoles undergo metamorphosis and leave the pond. Remaining tadpoles may then have higher growth rates as a result of an increase in the per capita food ration (Collins, 1979). Negative or random covariations may be the result of an environmental decline in per capita food level that is not counterbalanced by competitive release of metamorphs (Alford and Harris, 1988). It also may be the result of heterogeneous environmental effects (Travis, 1984). The natterjack toad (Bufo calamita) breeds in temporary ponds, and is often the only amphibian species present. Tadpole developmental time is short and may last less than 30 d. However, under crowded conditions individuals may extend their larval development up to 80 d. This implies a greater mortality and total absence of metamorphic success in dry years (Tejedo, 1992a); hence, faster growth rate may be highly adaptive. Much variation in egg size exists within populations, and this variation is related to female body size (Tejedo, 1992a). In this report we examined in the laboratory the relationships between two maternally induced variables (egg size and early hatchling size) and four fitness traits: size at metamorphosis; time of development; growth rate; and survival. The relationship was assessed for larvae of different sibships from a single population, under a range of density treatments. Moreover, growth trajectories and covariation between body size at metamorphosis and developmental time were analyzed across the different densities. MATERIALS AND METHODS A total of 41 egg clutches of B. calamita was sampled from a breeding pond at Sierra Morena, C6rdoba, Spain, during January 1988, ca. 12 h after oviposition, and the eggs were between midand late cleavage (stage 8-9; Gosner, 1960) when they were measured. Average egg size was determined by measuring the diameter of 10 randomly-selected eggs from each clutch. For each egg, the diameter was measured to the nearest 0.02 mm with a dissecting microscope and ocular micrometer. From each clutch, we selected 20 eggs within 0.05 mm of the average diameter. These were allowed to develop to Gosner stage 25 (initial feeding phase), at which time the tadpoles were measured and randomly assigned to four experimental densities consisting of either 1 (D1), 2 (D2), 4 (D4), or 8 (D8) individuals per container. Each group of tadpoles was placed in 15 cm diameter plastic pans that contained 250 ml of dechlorinated tap water. The range of experimental densities was similar to that observed in the pond (5-1000 tadpoles/m2; Tejedo, unpubl. data). Tadpoles were fed and the water changed three times per week. Each pan initially received 30 mg of Purina rabbit chow per feeding. Food rations were increased to 70 mg after 30 d of growth. The ration was kept constant throughout the experiment despite the fact that tadpoles in some treatments died or reached metamorphic climax. Food levels at the lower densities (1-2 tadpoles per pan) allowed unlimited growth. However, tadpoles at higher densities (4 and 8 individuals per pan) normally consumed their food by the second and first day after feeding, respectively. The experiment was conducted in laboratory conditions with natural light. Temperature oscillated around 1416 C. We measured snout-to-tail base and total length of tadpoles 15, 30, and 45 d after the start of the experiment. Both length measures minimized handling of tadpoles and were highly correlated with tadpole weight (total length, r2 = 0.801; snout-to-tail base length, r2 = 0.781, n = 53, P",W2324596757,False,0.8655551671981812
https://doi.org/10.1086/707597,Belowground Competition Can Influence the Evolution of Root Traits,"Although root traits play a critical role in mediating plant-plant interactions and resource acquisition from the soil environment, research examining whether and how belowground competition can influence the evolution of root traits remains largely unexplored. Here we examine the possibility that root traits may evolve as a target of selection from interspecific competition using Ipomoea purpurea and I. hederacea, two closely related morning glory species that commonly co-occur in the United States, as a model system. We show that belowground competitive interactions between the two species can alter the pattern of selection on root traits in each species. Specifically, competition with I. purpurea changes the pattern of selection on root angle in I. hederacea, and competitive interactions with I. hederacea change the pattern of selection on root size in I. purpurea. However, we did not uncover evidence that intraspecific competition altered the pattern of selection on any root traits within I. hederacea. Overall, our results suggest that belowground competition between closely related species can influence the phenotypic evolution of root traits in natural populations. Our findings provide a microevolutionary perspective of how competitive belowground interactions may impact plant fitness, potentially leading to patterns of plant community structure.",W2996026402,False,0.8358481526374817
https://doi.org/10.1086/674965,Conflicting Selection in the Course of Adaptive Diversification: The Interplay between Mutualism and Intraspecific Competition,"Adaptive speciation can occur when a population undergoes assortative mating and disruptive selection caused by frequency-dependent intraspecific competition. However, other interactions, such as mutualisms based on trait matching, may generate conflicting selective pressures that constrain species diversification. We used individual-based simulations to explore how different types of mutualism affect adaptive diversification. A magic trait was assumed to simultaneously mediate mate choice, intraspecific competition, and mutualisms. In scenarios of intimate, specialized mutualisms, individuals interact with one or few individual mutualistic partners, and diversification is constrained only if the mutualism is obligate. In other scenarios, increasing numbers of different partners per individual limit diversification by generating stabilizing selection. Stabilizing selection emerges from the greater likelihood of trait mismatches for rare, extreme phenotypes than for common intermediate phenotypes. Constraints on diversification imposed by increased numbers of partners decrease if the trait matching degree has smaller positive effects on fitness. These results hold after the relaxation of various assumptions. When trait matching matters, mutualism-generated stabilizing selection would thus often constrain diversification in obligate mutualisms, such as ant-myrmecophyte associations, and in low-intimacy mutualisms, including plant-seed disperser systems. Hence, different processes, such as trait convergence favoring the incorporation of nonrelated species, are needed to explain the higher richness of low-intimacy assemblages—shown here to be up to 1 order of magnitude richer than high-intimacy systems.",W1981437692,False,0.787079393863678
